h1,keyword,longitud,estilo,idioma,h2_1,h2_2,h2_3,h2_4,h2_5,h2_6
"Cómo aprender a programar desde cero","aprender programar",3000,informativo,es,"Qué es la programación","Lenguajes recomendados para principiantes","Recursos gratuitos para aprender","Errores comunes al empezar","Cómo crear tu primer proyecto","Consejos para mantener la motivación"
"Las mejores recetas de postres fáciles","postres fáciles",2500,conversacional,es,"Ingredientes básicos que siempre debes tener","Receta 1: Brownies de chocolate","Receta 2: Mousse de limón","Receta 3: Galletas de avena","Tips para decorar tus postres","Cómo conservar tus postres caseros"
"Guía completa de marketing digital 2025","marketing digital 2025",4000,profesional,es,"Qué es el marketing digital","Estrategias de SEO actualizadas","Marketing en redes sociales","Email marketing efectivo","Publicidad pagada (SEM)","Analítica y medición de resultados"
"Beneficios del yoga para principiantes","yoga principiantes",2000,informativo,es,"Qué es el yoga y sus orígenes","Beneficios físicos del yoga","Beneficios mentales y emocionales","Tipos de yoga para comenzar","Posturas básicas para principiantes","Cómo crear una rutina diaria"
"Cómo ahorrar dinero en el supermercado","ahorrar dinero supermercado",1800,conversacional,es,"Planifica tus compras con anticipación","Compara precios y usa apps","Aprovecha ofertas y cupones","Compra productos de temporada","Evita comprar con hambre","Lista de productos económicos y nutritivos"



